{"case_id":"flask-6096","annotator_id":"flask-6096-a","annotation_status":"COMPLETE","source":{"base_sha":"514fc6b3e8402e4c646d5284e97a4f0ab50a7c4b","head_sha":"7203feabf723edae0286ae5dc64fec8ac4c91735","repository_access_mode":"FROZEN_REPOSITORY_READ_ONLY"},"findings":[],"missing_context_requests":[],"review_summary":"Reviewed the frozen diff and bounded nearby code and tests. No actionable regression was supported by the repository evidence."}