{"case_id":"urllib3-4960","annotator_id":"urllib3-4960-a","annotation_status":"COMPLETE","source":{"base_sha":"c21b1c16cd8c08dd26876e223bc198a2b4de4fb3","head_sha":"ea687a19a86d8d0fcbc16c0737c41512efc80e87","repository_access_mode":"FROZEN_REPOSITORY_READ_ONLY"},"findings":[],"missing_context_requests":[],"review_summary":"Reviewed the frozen diff and bounded response decoder, buffer, and test code. No newly introduced issue is supported by the local evidence."}