{
  "case_id": "httpx-3699",
  "annotator_id": "httpx-3699-a",
  "annotation_status": "COMPLETE",
  "source": {
    "base_sha": "ca097c96f97d8d2a5da09b8ca736c7e78a2467f6",
    "head_sha": "4b9f63e507c4ea75fa59f6bbdfb103e2f014a6f9",
    "repository_access_mode": "FROZEN_REPOSITORY_READ_ONLY"
  },
  "findings": [],
  "missing_context_requests": [],
  "review_summary": "Reviewed the frozen diff and relevant authentication, export, and test code. FunctionAuth is already used internally; the change exposes it through the public imports and export list. No introduced issue was supported by the repository evidence."
}