{"case_id":"django-21754","annotator_id":"django-21754-b","annotation_status":"COMPLETE","source":{"base_sha":"73cc09f14f13fedddc14d6ba5b287cb33c24e4a4","head_sha":"1a180c837c27206932cd6abc14d3ef654390d9a9","repository_access_mode":"FROZEN_REPOSITORY_READ_ONLY"},"findings":[],"missing_context_requests":[],"review_summary":"Reviewed the frozen diff, the changed admin search logic, relevant form and model field conversion code, and nearby changelist tests. No independently supported new issue was found."}