{"case_id":"flask-6096","annotator_id":"flask-6096-b","annotation_status":"COMPLETE","source":{"base_sha":"514fc6b3e8402e4c646d5284e97a4f0ab50a7c4b","head_sha":"7203feabf723edae0286ae5dc64fec8ac4c91735","repository_access_mode":"FROZEN_REPOSITORY_READ_ONLY"},"findings":[{"annotation_finding_id":"flask-6096-b-1","issue_exists":true,"should_comment":true,"category":"explicit run port override blocked by SERVER_NAME port parsing","cwe":null,"path":"src/flask/app.py","start_line":725,"end_line":727,"severity":"low","evidence_refs":[{"path":"src/flask/app.py","start_line":725,"end_line":727,"revision":"7203feabf723edae0286ae5dc64fec8ac4c91735","description":"The configured SERVER_NAME port is parsed unconditionally."},{"path":"src/flask/app.py","start_line":736,"end_line":743,"revision":"7203feabf723edae0286ae5dc64fec8ac4c91735","description":"An explicit run port takes precedence, but this branch is reached only after SERVER_NAME parsing."},{"path":"src/flask/app.py","start_line":724,"end_line":735,"revision":"514fc6b3e8402e4c646d5284e97a4f0ab50a7c4b","description":"The base revision split SERVER_NAME as text and skipped converting its port when an explicit port was supplied."}],"technical_rationale":"For SERVER_NAME='localhost:65536', accessing urlsplit(...).port raises ValueError before app.run(port=8000) can apply the explicit override. The base revision could run with that override because it did not parse the configured port in this case.","comment_usefulness_rationale":"A focused comment can ask that configured-port validation occur only when that port is used, preserving the documented explicit port override."}],"missing_context_requests":[],"review_summary":"Reviewed the frozen diff and bounded surrounding implementation and tests. Found one low-severity regression in app.run port override handling."}