{"case_id":"urllib3-3786","annotator_id":"urllib3-3786-a","annotation_status":"COMPLETE","source":{"base_sha":"e8a81de5e1fe6b52dbcbdd93345560097c1e58fb","head_sha":"ca3151d13f9de266f14caa19c36ad6f4ed36657e","repository_access_mode":"FROZEN_REPOSITORY_READ_ONLY"},"findings":[],"missing_context_requests":[],"review_summary":"Reviewed the frozen diff and bounded proxy TLS implementation, documentation, and nearby tests. No newly introduced issue was established by the repository evidence."}