{"case_id":"django-21867","annotator_id":"django-21867-a","annotation_status":"COMPLETE","source":{"base_sha":"0751d5fed159fd9ff7edba522ece13c8c9d2a0d0","head_sha":"be010d8220d9100a8b87122eddc586c8c9bc44f0","repository_access_mode":"FROZEN_REPOSITORY_READ_ONLY"},"findings":[],"missing_context_requests":[],"review_summary":"Reviewed the frozen diff, the relevant QuerySet selection and iterable logic, and nearby in_bulk tests. No independently supported introduced issue was found."}