{"case_id":"flask-2284","annotator_id":"flask-2284-a","annotation_status":"COMPLETE","source":{"base_sha":"88120e9e9db38b6ccf851348542d5cd88e249881","head_sha":"2a6579430649d6514384ca592730c6995e140c43","repository_access_mode":"FROZEN_REPOSITORY_READ_ONLY"},"findings":[],"missing_context_requests":[],"review_summary":"Reviewed the frozen diff, the changed safe_join implementation, its send_from_directory caller, and nearby tests. No repository-supported newly introduced issue was found."}