{"case_id":"urllib3-4960","annotator_id":"urllib3-4960-b","annotation_status":"COMPLETE","source":{"base_sha":"c21b1c16cd8c08dd26876e223bc198a2b4de4fb3","head_sha":"ea687a19a86d8d0fcbc16c0737c41512efc80e87","repository_access_mode":"FROZEN_REPOSITORY_READ_ONLY"},"findings":[],"missing_context_requests":[],"review_summary":"Reviewed the frozen diff and relevant response buffering, decoding, read paths, and nearby tests. No newly introduced issue was supported by the repository evidence."}